{
  "kind": "playwright",
  "ui_url": "http://127.0.0.1:5173",
  "criteria": [
    {
      "criterion_id": "M01-AC1",
      "passed": true,
      "steps": [
        "Navigated to http://127.0.0.1:5173/",
        "Captured accessibility snapshot",
        "Took screenshot"
      ],
      "observed": "Page title is 'Service status' and the page shows a level-1 heading 'Service status' inside main.",
      "evidence": [
        "evidence/ac1-ac2-status-ok.png"
      ]
    },
    {
      "criterion_id": "M01-AC2",
      "passed": true,
      "steps": [
        "Navigated to http://127.0.0.1:5173/ with the real backend running at http://127.0.0.1:8000",
        "Waited 3 seconds",
        "Captured snapshot and screenshot",
        "Checked network log"
      ],
      "observed": "The paragraph reads 'Status: ok'. The status element shows 'ok' after GET http://127.0.0.1:8000/health returned 200.",
      "evidence": [
        "evidence/ac1-ac2-status-ok.png"
      ]
    },
    {
      "criterion_id": "M01-AC3",
      "passed": true,
      "steps": [
        "Loaded the page and waited",
        "Listed all network requests, including static ones"
      ],
      "observed": "Requests went to 127.0.0.1:5173 for /, /styles.css, /config.js, /status.js and /app.js. The only backend request was GET http://127.0.0.1:8000/health, which returned 200. No other backend endpoints were called. The browser's automatic favicon request to the frontend server returned 404; this is not a backend call.",
      "evidence": [
        "evidence/ac1-ac2-status-ok.png"
      ]
    },
    {
      "criterion_id": "M01-AC4",
      "passed": true,
      "steps": [
        "In the browser, routed all requests to http://127.0.0.1:8000/** to abort with connectionrefused, so the backend was unreachable",
        "Reloaded the page and waited 4 seconds",
        "Read the main element's text and took a screenshot",
        "Removed the route afterwards"
      ],
      "observed": "GET http://127.0.0.1:8000/health failed with net::ERR_CONNECTION_REFUSED. The page then showed 'Status: unavailable' and the error message 'The service could not be reached.' It did not stay on 'Checking…'. The backend was not actually stopped; the outage was simulated by blocking the request in the browser.",
      "evidence": [
        "evidence/ac4-unavailable.png"
      ]
    }
  ],
  "network_requests": [
    {
      "method": "GET",
      "url": "http://127.0.0.1:5173/",
      "status": 200
    },
    {
      "method": "GET",
      "url": "http://127.0.0.1:5173/styles.css",
      "status": 200
    },
    {
      "method": "GET",
      "url": "http://127.0.0.1:5173/config.js",
      "status": 200
    },
    {
      "method": "GET",
      "url": "http://127.0.0.1:5173/status.js",
      "status": 200
    },
    {
      "method": "GET",
      "url": "http://127.0.0.1:5173/app.js",
      "status": 200
    },
    {
      "method": "GET",
      "url": "http://127.0.0.1:5173/favicon.ico",
      "status": 404
    },
    {
      "method": "GET",
      "url": "http://127.0.0.1:8000/health",
      "status": 200
    },
    {
      "method": "GET",
      "url": "http://127.0.0.1:5173/",
      "status": 200
    },
    {
      "method": "GET",
      "url": "http://127.0.0.1:5173/styles.css",
      "status": 200
    },
    {
      "method": "GET",
      "url": "http://127.0.0.1:5173/config.js",
      "status": 200
    },
    {
      "method": "GET",
      "url": "http://127.0.0.1:5173/status.js",
      "status": 200
    },
    {
      "method": "GET",
      "url": "http://127.0.0.1:5173/app.js",
      "status": 200
    },
    {
      "method": "GET",
      "url": "http://127.0.0.1:8000/health"
    }
  ],
  "contract": {
    "passed": true,
    "unmatched_operations": []
  },
  "unit_tests": {
    "enabled": false
  },
  "boundary": {
    "passed": true,
    "violations": []
  },
  "passed": true
}
