{
  "kind": "playwright",
  "ui_url": "http://127.0.0.1:5173",
  "criteria": [
    {
      "criterion_id": "M01-AC1",
      "passed": true,
      "steps": [
        "Navigated to http://127.0.0.1:5173/",
        "Captured accessibility snapshot and evaluated document.querySelector('h1').textContent",
        "Took screenshot"
      ],
      "observed": "Page title 'Service status'; a level-1 heading reading 'Service status' is shown.",
      "evidence": [
        "evidence/ac1-ac2-status-ok.png"
      ]
    },
    {
      "criterion_id": "M01-AC2",
      "passed": true,
      "steps": [
        "Navigated to http://127.0.0.1:5173/ with the real backend running",
        "Waited 3 seconds",
        "Read the network log and document.getElementById('status').textContent",
        "Took screenshot"
      ],
      "observed": "Network log shows GET http://127.0.0.1:8000/health => 200. The element with id=\"status\" (role=status) reads 'Status: ok'.",
      "evidence": [
        "evidence/ac1-ac2-status-ok.png"
      ]
    },
    {
      "criterion_id": "M01-AC3",
      "passed": true,
      "steps": [
        "Loaded the page and reviewed the full network log (including static resources)",
        "Compared backend requests against api-spec.json"
      ],
      "observed": "The only request to the backend (127.0.0.1:8000) was GET /health, which matches operationId getHealth (GET /health) in the spec. All other requests were to the frontend origin 5173 (/, /config.js, /app.js, and a /favicon.ico 404 seen in the console).",
      "evidence": [
        "evidence/ac1-ac2-status-ok.png"
      ]
    },
    {
      "criterion_id": "M01-AC4",
      "passed": true,
      "steps": [
        "In the browser, installed a Playwright route that aborts all requests to http://127.0.0.1:8000/** with connectionrefused, simulating an unreachable backend (no files or servers were changed)",
        "Reloaded http://127.0.0.1:5173/",
        "Waited 4 seconds and read document.getElementById('status').textContent",
        "Took screenshot"
      ],
      "observed": "GET http://127.0.0.1:8000/health failed with net::ERR_CONNECTION_REFUSED; the status element reads 'Status: unavailable' (not 'Checking…' or blank).",
      "evidence": [
        "evidence/ac4-status-unavailable.png"
      ]
    }
  ],
  "network_requests": [
    {
      "method": "GET",
      "url": "http://127.0.0.1:5173/",
      "status": 200
    },
    {
      "method": "GET",
      "url": "http://127.0.0.1:5173/config.js",
      "status": 200
    },
    {
      "method": "GET",
      "url": "http://127.0.0.1:5173/app.js",
      "status": 200
    },
    {
      "method": "GET",
      "url": "http://127.0.0.1:5173/favicon.ico",
      "status": 404
    },
    {
      "method": "GET",
      "url": "http://127.0.0.1:8000/health",
      "status": 200
    },
    {
      "method": "GET",
      "url": "http://127.0.0.1:5173/",
      "status": 200
    },
    {
      "method": "GET",
      "url": "http://127.0.0.1:5173/config.js",
      "status": 200
    },
    {
      "method": "GET",
      "url": "http://127.0.0.1:5173/app.js",
      "status": 200
    },
    {
      "method": "GET",
      "url": "http://127.0.0.1:8000/health"
    }
  ],
  "contract": {
    "passed": true,
    "unmatched_operations": []
  },
  "unit_tests": {
    "enabled": false
  },
  "boundary": {
    "passed": true,
    "violations": []
  },
  "passed": true
}
